{
  "$schema": "/components/geometry-part/1.0.2/geometry-part.schema.json",
  "key": "part 1",
  "name": "geometry part 1",
  "data_source": "https://mycompany/mesh11.stl",
  "feature": {
    "name": "feature 1",
    "kind": "Soil",
    "material_key": "soil"
  },
  "transform": [
    1.0,
    0.0,
    0.0,
    45.0,
    0.0,
    1.0,
    0.0,
    45.0,
    0.0,
    0.0,
    1.0,
    30.0,
    0.0,
    0.0,
    0.0,
    1.0
  ],
  "bounding_box": {
    "min_y": 5,
    "max_y": 10,
    "min_x": 0,
    "max_x": 10,
    "min_z": 5,
    "max_z": 10
  },
  "geometry": {
    "brep_container": {
      "format": "STEP",
      "producer": "Plaxis",
      "brep": {
        "width": 1,
        "data_type": "uint8",
        "length": 2000,
        "data": "abababababababababababababababababababababababababababababababab"
      }
    },
    "mesh": {
      "kind": "Open",
      "quality": {
        "characteristics": [
          "NonSelfIntersecting",
          "Continuous"
        ]
      },
      "triangles": {
        "width": 3,
        "data_type": "uint64",
        "length": 4,
        "data": "abababababababababababababababababababababababababababababababab"
      }
    },
    "points_2d": [
      0,
      1,
      2,
      3,
      4,
      5,
      6,
      7,
      8,
      9,
      10
    ],
    "polylines_2d": [
      {
        "begin": 1,
        "count": 3,
        "closed": "Closed",
        "shape": "Straight"
      },
      {
        "begin": 7,
        "count": 3,
        "closed": "Closed",
        "shape": "Curved"
      }
    ],
    "points_3d": [
      0,
      1,
      2,
      3,
      4,
      5,
      6,
      7,
      8,
      9,
      10
    ],
    "polylines_3d": [
      {
        "begin": 1,
        "count": 2,
        "closed": "Closed"
      },
      {
        "begin": 5,
        "count": 3,
        "closed": "Open"
      }
    ]
  }
}
